Views,Title,Link
1.1M views,Zadruga 4 - Brutalan sukob Vladimira i Danijela - 06.02.2021.,https://www.youtube.com/watch?v=0JRC3QWAb80
292K views,"Ovako je grupa Velje Nevolje namamila Milana Ljepoju u kuću u Ritopeku, odakle nikad nije izašao",https://www.youtube.com/watch?v=86Hy23h4Nzk
546K views,Milica Pavlovic - Crna jutra (Balkan S&M) - Official Video 2021,https://www.youtube.com/watch?v=l7N9xD7hspE
517K views,Ana Korać o raskidu sa Davidom (Ami G Show S13),https://www.youtube.com/watch?v=0v__GutEGpY
423K views,Ana Korać o tome što je Maja Marinković kopira (Ami G Show S13),https://www.youtube.com/watch?v=9mx-4l5Gp0Y
181K views,Predrag Popović: O vezi Velje Nevolje sa Danilom i Aleksandrom Vučićem,https://www.youtube.com/watch?v=cZxiwo9F5TA
164K views,Ko su Veljko Belivuk i članovi njegove kriminalne grupe,https://www.youtube.com/watch?v=GlYDpFAKA2g
162K views,UHAPSEN NAJOPASNIJI COVEK BEOGRADA VELJA NEVOLJA??!,https://www.youtube.com/watch?v=y64v9L1grWk
12M views,The Weeknd’s FULL Pepsi Super Bowl LV Halftime Show,https://www.youtube.com/watch?v=9rhadTURsrw
153K views,🃏 CAREER-HIGH 50 Points For Nikola Jokic 🃏,https://www.youtube.com/watch?v=eBN5cogUUsI
9.4M views,Voyage x Breskvica - Beli Grad (Official Video) Prod. by Andre,https://www.youtube.com/watch?v=6jrwZmqq6xA
544K views,DZENAN LONCAREVIC - ZIVOTE DUSE MOJE (OFFICIAL VIDEO),https://www.youtube.com/watch?v=kk3NaShjMZk
105K views,Vučić na pitanja Insajdera: Nadležni proveravaju povezanost Veljka Belivuka sa državnim strukturama,https://www.youtube.com/watch?v=1MyReQjqJ_M
300K views,"Dr Nestorovic komentarise Fajzer vakcinu i ""misteriozni nestanak"" ebole nakon pojave Ruske vakcine!",https://www.youtube.com/watch?v=nCFIGGGVFUs
165K views,"Uz Velju Nevolju uhapsite i Vazuru! Ub**jali na stadionu, to je osnovana sumnja - Milan Dumanović",https://www.youtube.com/watch?v=GIMHpzFe3uM
245K views,"CIRILICA - Jedna od najzustrijih emisija - Seselj, Nestorovic, Bokan i Ceda Jovanovic - (01.02.2021)",https://www.youtube.com/watch?v=TyPp4JDq__U
219K views,Ceda Jovanovic napusta emisiju zbog optuzbi dr Seselja da je ucestvovao u Djindjicevom atentatu!,https://www.youtube.com/watch?v=lPxCTDhl5xI
88K views,"7 na N1: Šokirao klan Belivuka, tek će iznenaditi nove vakcine koje stižu",https://www.youtube.com/watch?v=7Mddv4jTZdc
319K views,Specijal: VW Passat sa MILION kilometara!,https://www.youtube.com/watch?v=-IOgcW3KQzQ
24M views,Cardi B - Up [Official Music Video],https://www.youtube.com/watch?v=rCiBgLOcuKU
4.2M views,11 Crazy Ways to Sneak Food Into the Hospital! Funny Situations & Edible DIY Ideas by Crafty Panda,https://www.youtube.com/watch?v=F23qliAYp08
104K views,Dr. Nestorović Najavio Svoju Smrt i Čija je Meta - Postaću Legenda - Doktor Zbunio Javnost,https://www.youtube.com/watch?v=7Usszn1CW8w
463K views,TOZLA - LJUBAV (OFFICIAL VIDEO),https://www.youtube.com/watch?v=EQ9WZGfjQ8M
89K views,JUTRO - Vulin: Snajper pronađen | PRVA,https://www.youtube.com/watch?v=8d5mglIuZLA
259K views,"NESTOROVIĆ UZBUNIO JAVNOST - Ko JE PRIMIO, SIGURNO NEĆE DOČEKATI PROLEĆE!?",https://www.youtube.com/watch?v=WAWpydxlaHc
4.7M views,Konfuz — Ратата (Mood video),https://www.youtube.com/watch?v=BGJ9w88yKTo
108K views,šta sam shvatila posle raskida?,https://www.youtube.com/watch?v=daDt-34F-u4
1.9M views,RIMSKI - KO KRIV JE? (OFFICIAL VIDEO),https://www.youtube.com/watch?v=s09LeHs_aSY
196K views,"ĐORĐE MILUTINOVIĆ U SUZAMA NAKON ZADRUGE: Ne može da boli ni jedan udarac, bitno da mi je obraz čist",https://www.youtube.com/watch?v=8b4gidvx27Y
5.7M views,Chiefs vs. Buccaneers | Super Bowl LV Game Highlights,https://www.youtube.com/watch?v=Gz5-NQROQGw
202K views,ROMSKA PITA-Sto posto ukusnija od bureka!!Jednostavna i laka za pripremu da jednostavnije nemože!!,https://www.youtube.com/watch?v=85odLJbs1Z8
171K views,GLAMUR - SOKANTNO! Jelena Karleusa progovorila i otkrila pravu istinu o odnosu sa Duskom Tosicem!,https://www.youtube.com/watch?v=AxclM21F0zE
96K views,KAKO NAPRAVITI LOGO NA CNC | How to make a LOGO with a CNC machine,https://www.youtube.com/watch?v=gj_CP2og_ok
7.8M views,SIDEMEN TINDER IN REAL LIFE 3,https://www.youtube.com/watch?v=KF8I09WBtEI
234K views,Nikola Jokic Ties His CAREER-HIGH With 47 PTS in Home W! 🃏,https://www.youtube.com/watch?v=pOvQwGIiEMg
145K views,DRŽAVNI POSAO [HQ] - Ep.1529: Dobra reakcija (02.02.2021.),https://www.youtube.com/watch?v=zGL3yg41elw
93K views,Mila Alečković - Uskoro će ljudi saznati da je sve ovo najveća prevara 21. veka!,https://www.youtube.com/watch?v=UEWJXf4bA6w
548K views,Cunami - Hazla,https://www.youtube.com/watch?v=HxS-2H8utGA
858K views,Brak na nevidjeno: Morbidna alternativka i bivsi kriminalac,https://www.youtube.com/watch?v=7y8HLo6oyD0
288K views,PRVI RAD NA CNC-u - MUDJA LOGO !,https://www.youtube.com/watch?v=PRhZs5Ttetk
100K views,Matea Milosavljević: Živela sam na parkingu Ade Ciganlije! | GUGLALI SMO | S03E33,https://www.youtube.com/watch?v=nWdBZw7gM6o
155K views,Dr. Nestorović Saznao: Počinju da Gase Pandemiju a Evo i Zbog Čega,https://www.youtube.com/watch?v=7f_T7b2DLGI
79K views,BISER NEDELJE - Veče sa Ivanom Ivanovićem 587.,https://www.youtube.com/watch?v=kz4XfghYvwM
511K views,"Zadruga 4 - Nikad žustriji okršaj Miljane i Kristijana, lom u Beloj kući - 07.02.2021.",https://www.youtube.com/watch?v=2JqrW0ROy7M
13M views,World's Longest Field Goal- Robot vs NFL Kicker,https://www.youtube.com/watch?v=P_6my53IlxY
141K views,"DOBRO JUTRO, KOMŠIJA \\ SEZONA 3 \\ EPIZODA 1 - TRAILER",https://www.youtube.com/watch?v=bHf-ixjBVq8
92K views,FRANCUSKA REVOLUCIJA (1789) | DRUGI DEO,https://www.youtube.com/watch?v=X7R_FH-iORI
358K views,"Draško Stanivuković objavljuje javno sav KRIMINAL SNSD-a, Milorada Dodika i Lukača u gradskoj upravi",https://www.youtube.com/watch?v=1RWlXE0A1X8
3.4M views,3D PEN VS GLUE GUN! 17 Cool Hacks And Crafts For You,https://www.youtube.com/watch?v=NI0PngB4-XQ
124K views,Velja Nevolja i njegovi državni jataci! - Kako niko nije znao za bunker?! (Parović),https://www.youtube.com/watch?v=P4-P8DI1Dno
